{
  "task_id": "T001",
  "agent_id": "agent_b",
  "agent_role": "reviewer_finisher",
  "status": "DONE",
  "files_changed": [
    "PROJECT_BOARD.md",
    ".board/tasks.yaml",
    ".board/handoffs/T001_agent_b_handoff.json"
  ],
  "commands_run": [
    {
      "command": "PYTHONDONTWRITEBYTECODE=1 PYTHONPATH=demo_repo_template/src python3 -m unittest discover -s demo_repo_template/tests -p 'test_parser.py'",
      "result": "PASS",
      "notes": "Ran 5 T001 parser tests; all passed."
    },
    {
      "command": "PYTHONDONTWRITEBYTECODE=1 PYTHONPATH=demo_repo_template/src python3 -m unittest discover -s demo_repo_template/tests",
      "result": "PASS",
      "notes": "Ran 10 demo repo tests as a regression check; all passed."
    },
    {
      "command": "python3 scripts/run_score.py --task benchmark/tasks/task_001_date_parser.yaml --repo . --output /tmp/boardflow_t001_agent_b_score.json",
      "result": "PASS",
      "notes": "Scorer reported total=100 with no violations; output was removed after inspection."
    }
  ],
  "tests": [
    {
      "name": "test_parser.py",
      "result": "PASS",
      "notes": "Verified YYYY-MM-DD, YYYY/MM/DD, whitespace around slash dates, malformed date rejection, and JSON fixture loading."
    },
    {
      "name": "demo_repo_template/tests",
      "result": "PASS",
      "notes": "Full demo test discovery passed as a lightweight regression check."
    }
  ],
  "temporary_files_created": [
    "/tmp/boardflow_t001_agent_b_score.json"
  ],
  "temporary_files_removed": [
    "/tmp/boardflow_t001_agent_b_score.json"
  ],
  "decisions": [
    "Accepted Agent A's repository-local handoff as sufficient to continue without any chat transcript.",
    "Did not rewrite Agent A's parser/test work because the relevant tests and source behavior satisfy T001 acceptance criteria.",
    "Marked T001 DONE after acceptance and regression tests passed and this completion handoff was created."
  ],
  "risks": [
    "The repository still has no tracked git baseline, so scorer scope and unexpected-untracked checks may remain limited.",
    "T001 has no explicit regression_commands field in the task YAML; Agent B ran full demo unittest discovery as a manual regression check."
  ],
  "next_recommended_step": "Start T002 from repository-local BoardFlow state only: read AGENTS.md, AI_CONTRACT.md, PROJECT_BOARD.md, .board/tasks.yaml, the T002 task YAML, and the latest relevant handoff before changing code."
}
