{
  "agent_id": "codex",
  "agent_role": "release",
  "commands_run": [
    {
      "command": "PYTHONDONTWRITEBYTECODE=1 PYTHONPATH=. python3 -m pytest -p no:cacheprovider",
      "notes": "111 passed in local final validation and both independent rereviews reported the same result.",
      "result": "PASS"
    },
    {
      "command": "git diff --check",
      "notes": "No whitespace errors in local final validation and both independent rereviews.",
      "result": "PASS"
    },
    {
      "command": "PYTHONDONTWRITEBYTECODE=1 PYTHONPATH=. python3 - <<'PY' ... check_board_views('.') ... PY",
      "notes": "Returned [] in local final validation and both independent rereviews.",
      "result": "PASS"
    }
  ],
  "decisions": [
    "Mark P008 DONE because two independent read-only rereviews found no blocking findings.",
    "Mark milestone M2 DONE because P008 was the remaining M2 task.",
    "Keep OS sandboxing and subprocess timeout as follow-up hardening outside P008 scope."
  ],
  "files_changed": [
    ".board/tasks.yaml",
    ".board/handoffs/P008_codex_1780411029751578000.json",
    ".board/reviews/P008_independent_rereview.md",
    "PROJECT_BOARD.md",
    ".repo_manager/agent_context.md"
  ],
  "next_recommended_step": "Open or update the pull request from yihao/feature to master and track timeout and sandbox runner hardening as follow-up work.",
  "risks": [
    "HMAC and digest checks do not replace OS sandboxing for hostile same-user processes.",
    "Agent, reviewer, and oracle subprocess timeout remains a follow-up availability hardening task."
  ],
  "status": "DONE",
  "task_id": "P008",
  "temporary_files_created": [
    "/private/tmp/p008_done_handoff.json"
  ],
  "temporary_files_removed": [],
  "tests": [
    {
      "name": "Protocol security independent rereview",
      "notes": "No blocking findings; residual risks are OS sandboxing and subprocess timeout.",
      "result": "PASS"
    },
    {
      "name": "Architecture lifecycle independent rereview",
      "notes": "No blocking findings; residual risks are OS sandboxing, subprocess timeout, and read-only final pass did not rerun sibling smoke.",
      "result": "PASS"
    },
    {
      "name": "Full local test suite",
      "notes": "111 passed.",
      "result": "PASS"
    }
  ]
}
