{
  "task_id": "P007",
  "agent_id": "codex",
  "agent_role": "implementer",
  "status": "DONE",
  "files_changed": [
    "repo_manager_core/benchmark/aggregation.py",
    "scripts/aggregate_benchmark_results.py",
    "skills/boardflow-reviewer/SKILL.md",
    "install/install_claude.sh",
    "README.md",
    "docs/EXPERIMENT_PROTOCOL.md",
    "docs/中文说明与扩展指南.md",
    "tests/test_aggregation.py",
    "tests/test_runner.py"
  ],
  "commands_run": [
    {
      "command": "PYTHONDONTWRITEBYTECODE=1 PYTHONPATH=. python3 scripts/aggregate_benchmark_results.py --results-dir /tmp/boardflowbench-runner-results --output /tmp/boardflowbench-runner-results/summary.json",
      "result": "PASS",
      "notes": "External aggregation completed after the real four-stage smoke run."
    },
    {
      "command": "git diff --check",
      "result": "PASS",
      "notes": "No whitespace errors."
    }
  ],
  "tests": [
    {
      "name": "external result aggregation",
      "result": "PASS",
      "notes": "Smoke summary reported pass rate 1.0 and zero regressions, scope drift, hygiene, handoff, and board consistency violations."
    },
    {
      "name": "non-blocking reviewer adapter",
      "result": "PASS",
      "notes": "Reviewer JSON risks are recorded without replacing deterministic acceptance."
    }
  ],
  "temporary_files_created": [],
  "temporary_files_removed": [],
  "decisions": [
    "Aggregate overall and per-condition metrics from external run directories.",
    "Keep independent reviewer findings non-blocking so an AI reviewer cannot approve its own implementation.",
    "Provide a separate read-only boardflow-reviewer skill."
  ],
  "risks": [
    "An independent read-only reviewer sub-agent was requested after implementation, but the service rejected the run because its usage quota was exhausted. Deterministic gates, local audit, and regression tests were completed; no independent qualitative report is attached."
  ],
  "next_recommended_step": "Run calibrated multi-agent experiments and inspect per-condition summaries alongside reviewer reports."
}
